{
  "opportunity_id": "example_club_event",
  "content_revision": 1,
  "review_status": "approved",
  "reviewer": "data-owner",
  "reviewed_at": "2026-10-26T13:00:00Z",
  "reason": "Synthetic fixture demonstrates manual approval.",
  "field_overrides": {
    "title": "Example Data Workshop",
    "activity_type_ids": ["workshop"]
  }
}
